{"schemaVersion":1,"product":"IERS Bulletin A finals2000A UT1-UTC","timeScale":"UTC","units":{"mjdUtc":"day","dut1":"second","uncertainty":"second"},"source":{"title":"IERS Bulletin A finals2000A","url":"https://maia.usno.navy.mil/ser7/finals2000A.all","formatUrl":"https://maia.usno.navy.mil/ser7/readme.finals2000A","checksumUrl":"https://maia.usno.navy.mil/ser7/checksums.sha512","productMetadataUrl":"https://datacenter.iers.org/versionMetadata.php?filename=latestVersionMeta%2F9_FINALS.ALL_IAU2000_V2013_019.txt","retrievedAt":"2026-07-29T09:10:13.165Z","sourceLastModified":"2026-07-23T17:46:35.000Z","sourceSha256":"f707ea5031a467f1a3b2f0645fac2f627095ed0cb41d34c515b495cb81a5a25d","officialSourceSha512":"b5e8afa4a628c395025c118f9f48102ead13bdca22c79b89ab74d03b10a34493169438b313ef427ac803edb6258b81772ee381d408a129bfc79c3fc488478ec5","formatSha256":"3efb2c610012360391aed5c057489ff74539b78494a66b7f9b342d1843db9254","checksumSha256":"e81dfb49a3680bea439fec55b338d81e6be63abbfc552ee8e238ac7de81d6cc5","attribution":"IERS Rapid Service/Prediction Center at USNO","distributionStatement":"Distribution Statement A. Approved for public release: distribution unlimited.","distributionUrl":"https://maia.usno.navy.mil/products/daily","rawSnapshot":"shared/eop/source/finals2000A.all","formatSnapshot":"shared/eop/source/readme.finals2000A","checksumSnapshot":"shared/eop/source/checksums.sha512"},"statusCodes":{"I":"observed","P":"predicted"},"encoding":{"mjdUtc":"chunk.startMjdUtc + zero-based record index","numeric":"first absolute integer microseconds followed by signed daily deltas","quality":"qualityRanges entries are [startOffset, endOffsetExclusive, I|P]","maximumQuantizationErrorSeconds":5e-7},"coverage":{"firstMjdUtc":41684,"lastMjdUtc":61617,"observedThroughMjdUtc":61244,"predictionStartsMjdUtc":61245,"recordCount":19934,"observedCount":19561,"predictedCount":373,"missingUt1TailRows":50,"leapSecondBoundaryCount":25},"chunks":[{"file":"shared/eop/dut1/41684.v1.json","startMjdUtc":41684,"endMjdUtc":45779,"recordCount":4096,"observedCount":4096,"predictedCount":0,"rawBytes":35956,"gzipBytes":12318,"sha256":"041270b9b8fb16f80284ed9703a59b3c8b0d6029a32f2bff22658bb1851eaf74"},{"file":"shared/eop/dut1/45780.v1.json","startMjdUtc":45780,"endMjdUtc":49875,"recordCount":4096,"observedCount":4096,"predictedCount":0,"rawBytes":34688,"gzipBytes":12256,"sha256":"6549842e046476585bcd251cfae468f56ce1cc85234539e7b0b76c20d87d703d"},{"file":"shared/eop/dut1/49876.v1.json","startMjdUtc":49876,"endMjdUtc":53971,"recordCount":4096,"observedCount":4096,"predictedCount":0,"rawBytes":31141,"gzipBytes":10713,"sha256":"a218f2d1e1cb372f65f7c5cf369c1f9e7610d419a702e362726b9b9c685fef64"},{"file":"shared/eop/dut1/53972.v1.json","startMjdUtc":53972,"endMjdUtc":58067,"recordCount":4096,"observedCount":4096,"predictedCount":0,"rawBytes":31496,"gzipBytes":10442,"sha256":"ea72a376c9843a6d1c71f4bbffcb2e6d373dbdae7e8fa5ff4ac60adf5d16b6fe"},{"file":"shared/eop/dut1/58068.v1.json","startMjdUtc":58068,"endMjdUtc":61617,"recordCount":3550,"observedCount":3177,"predictedCount":373,"rawBytes":24730,"gzipBytes":9068,"sha256":"3a41a6c392d58c0f934746da51a4112649cb5eec2815ea06c5b846966fdf4ecc"}]}
